tconst,primaryTitle,seriesName,seasonNumber,episodeNumber,averageRating,numVotes,ranking
tt0583452,The One Where Everybody Finds Out,Friends,5,14,9.7,12271,1
tt0583433,The Last One,Friends,10,17,9.6,15793,2
tt6439870,Super Bowl Sunday,This Is Us,2,14,9.7,6177,3
tt3390684,How Your Mother Met Me,How I Met Your Mother,9,16,9.5,10447,4
tt6674736,The Stockholm Syndrome,The Big Bang Theory,12,24,9.5,9874,5
tt4389744,Connection Lost,Modern Family,6,16,9.5,7736,6
tt1643647,Death and All His Friends,Grey's Anatomy,6,24,9.7,3768,7
tt14691148,"And so, begin again",Broken But Beautiful,3,10,9.6,4911,8
tt14691124,A Sense Of The Ending.,Broken But Beautiful,3,7,9.6,4874,9
tt1643648,Sanctuary,Grey's Anatomy,6,23,9.7,3368,10
tt18311178,Episode #1.13,Not Me,1,13,9.6,4249,11
tt0583600,The One with the Embryos,Friends,4,12,9.4,8940,12
tt19064730,The Train,This Is Us,6,17,9.7,3047,13
tt3972954,Dragonfly in Amber,Outlander,2,13,9.5,5177,14
tt6142668,Memphis,This Is Us,1,16,9.5,4992,15
tt0885872,Slap Bet,How I Met Your Mother,2,9,9.4,7612,16
tt14691138,Eternal Sunshine of the Helpless Mind.,Broken But Beautiful,3,8,9.5,4790,17
tt17941224,Episode #1.9,Not Me,1,9,9.5,4563,18
tt0583635,The One with the Prom Video,Friends,2,14,9.3,8243,19
tt21034246,"Dual Confessions, Part 2/The Shuchiin Afterparty",Kaguya-sama: Love is War,3,13,9.8,2056,20
tt2556008,The Final Page: Part Two,How I Met Your Mother,8,12,9.3,7156,21
tt1541289,The Playbook,How I Met Your Mother,5,8,9.3,6954,22
tt18311176,Episode #1.12,Not Me,1,12,9.4,4529,23
tt17941228,Episode #1.10,Not Me,1,10,9.4,4464,24
tt13605474,It Happened That Night,Broken But Beautiful,3,1,9.3,5589,25
tt16277092,Episode #1.1,Not Me,1,1,9.3,5164,26
tt1435079,Now or Never,Grey's Anatomy,5,24,9.5,2877,27
tt17518176,Episode #1.8,Not Me,1,8,9.3,5100,28
tt9611736,Silent All These Years,Grey's Anatomy,15,19,9.5,2793,29
tt14690636,"You, Me, Him and Her",Broken But Beautiful,3,3,9.3,4896,30
tt16406014,Episode #1.2,Not Me,1,2,9.3,4807,31
tt0583642,The One with the Rumor,Friends,8,9,9.2,7513,32
tt17180046,Episode #1.6,Not Me,1,6,9.3,4553,33
tt18304882,Episode #1.11,Not Me,1,11,9.3,4500,34
tt12412622,"Yu Ishigami Closes His Eyes, Part 3/Miyuki Shirogane and Yu Ishigami/Kyoko Otomo Doesn't Realize",Kaguya-sama: Love is War,2,11,9.7,1857,35
tt19064724,Miguel,This Is Us,6,15,9.5,2588,36
tt5734500,Pilot,This Is Us,1,1,9.2,6628,37
tt0954401,The One with the Proposal,Friends,6,25,9.2,6285,38
tt0583658,The One with the Videotape,Friends,8,4,9.2,6138,39
tt0592911,It's the End of the World,Grey's Anatomy,2,16,9.4,2979,40
tt0759138,As We Know It,Grey's Anatomy,2,17,9.4,2891,41
tt3809316,The Devil's Mark,Outlander,1,11,9.2,5315,42
tt0757574,"With Tired Eyes, Tired Minds, Tired Souls, We Slept",One Tree Hill,3,16,9.7,1662,43
tt14690638,La La La land,Broken But Beautiful,3,4,9.2,4822,44
tt14691142,The Fault in Their Stars,Broken But Beautiful,3,9,9.2,4766,45
tt6439868,That'll Be the Day,This Is Us,2,13,9.3,3411,46
tt10322330,The Cabin,This Is Us,4,14,9.5,2174,47
tt16478032,Episode #1.3,Not Me,1,3,9.2,4654,48
tt17179270,Episode #1.7,Not Me,1,7,9.2,4592,49
tt16673622,Episode #1.4,Not Me,1,4,9.2,4582,50
tt16978166,Episode #1.5,Not Me,1,5,9.2,4569,51
tt13883800,Boyfriend,Heartstopper,1,8,9.3,3311,52
tt4462712,Faith,Outlander,2,7,9.2,4360,53
tt1256021,The Bath Item Gift Hypothesis,The Big Bang Theory,2,11,9.1,6620,54
tt0606115,The Pineapple Incident,How I Met Your Mother,1,10,9.1,6441,55
tt0583482,The One Where Ross Got High,Friends,6,9,9.1,6252,56
tt0831991,The One with Ross's Wedding: Part 2,Friends,4,24,9.1,6227,57
tt0568062,On the Beach,ER,8,21,9.6,1656,58
tt1256191,The Naked Man,How I Met Your Mother,4,9,9.1,5474,59
tt0583532,The One with Monica and Chandler's Wedding: Part 2,Friends,7,24,9.1,5401,60
tt14691096,"Crazy, Stupid, Foolish Love.",Broken But Beautiful,3,5,9.1,4780,61
tt14691116,This Could Be Us,Broken But Beautiful,3,6,9.1,4771,62
tt0567922,All in the Family,ER,6,14,9.6,1526,63
tt5432614,The Day in Question,11.22.63,1,8,9.1,4484,64
tt6439848,Number One,This Is Us,2,8,9.2,3193,65
tt3508788,Vegas,Modern Family,5,18,9.1,4196,66
tt4419112,Christmas Special,Downton Abbey,6,9,9.3,2354,67
tt0805280,Losing My Religion,Grey's Anatomy,2,27,9.3,2353,68
tt0583606,The One with the Flashback,Friends,3,6,9.0,6384,69
tt0583501,The One with the Morning After,Friends,3,16,9.0,6257,70
tt0583652,The One with All the Thanksgivings,Friends,5,8,9.0,6217,71
tt0583570,The One with Unagi,Friends,6,17,9.0,6117,72
tt3863916,The Garrison Commander,Outlander,1,6,9.0,6101,73
tt0583515,The One with Chandler in a Box,Friends,4,8,9.0,6081,74
tt0583563,The One with Ross's Sandwich,Friends,5,9,9.0,5760,75
tt5134994,The Sound of Silence,Grey's Anatomy,12,9,9.3,2225,76
tt0583511,The One with All the Resolutions,Friends,5,11,9.0,5629,77
tt6439862,The Fifth Wheel,This Is Us,2,11,9.2,2777,78
tt0831990,The One in Vegas: Part 2,Friends,5,24,9.0,5555,79
tt1570154,Girls vs. Suits,How I Met Your Mother,5,12,9.0,5542,80
tt6463872,Of Lost Things,Outlander,3,4,9.1,3659,81
tt6439884,The Car,This Is Us,2,15,9.2,2734,82
tt0606107,Game Night,How I Met Your Mother,1,15,9.0,5297,83
tt0583638,The One with the Red Sweater,Friends,8,2,9.0,5291,84
tt5143516,The Opening Night Excitation,The Big Bang Theory,9,11,9.0,5092,85
tt1777828,Blitzgiving,How I Met Your Mother,6,10,9.0,5072,86
tt1648756,The Staircase Implementation,The Big Bang Theory,3,22,9.0,5069,87
tt14690632,Love and all other drugs,Broken But Beautiful,3,2,9.0,5018,88
tt3635890,There's No Place Like Home,Once Upon a Time,3,22,9.2,2590,89
tt1140904,Spoiler Alert,How I Met Your Mother,3,8,9.0,4786,90
tt6674734,The Change Constant,The Big Bang Theory,12,23,9.0,4772,91
tt9734994,P.I. Joe,You,2,9,9.0,4748,92
tt0583579,The One with the Blackout,Friends,1,7,8.9,8022,93
tt0583464,The One Where No One's Ready,Friends,3,2,8.9,6994,94
tt13883786,Kiss,Heartstopper,1,3,9.1,3005,95
tt0583607,The One with the Football,Friends,3,9,8.9,6689,96
tt0583481,The One Where Ross Finds Out,Friends,2,7,8.9,6498,97
tt0583656,The One with the Two Parties,Friends,2,22,8.9,6215,98
tt10322338,Strangers: Part Two,This Is Us,4,18,9.3,1826,99
tt0583620,The One with the Jellyfish,Friends,4,1,8.9,6106,100
tt6463874,Freedom & Whisky,Outlander,3,5,9.0,3567,101
tt0583507,The One with All the Kissing,Friends,5,2,8.9,5460,102
tt0583494,The One Where the Stripper Cries,Friends,10,11,8.9,5436,103
tt1536922,The Adhesive Duck Deficiency,The Big Bang Theory,3,8,8.9,5258,104
tt0583466,The One Where Paul's the Man,Friends,6,22,8.9,5256,105
tt0875360,Swarley,How I Met Your Mother,2,7,8.9,5209,106
tt6072390,Pilgrim Rick,This Is Us,1,8,9.0,3435,107
tt8399434,The Birds and The Bees,Outlander,4,9,9.1,2550,108
tt0688355,Kalends of February,Rome,1,12,9.1,2524,109
tt2102769,Tick Tick Tick,How I Met Your Mother,7,10,8.9,4952,110
tt1795967,Bad News,How I Met Your Mother,6,13,8.9,4816,111
tt1121411,How I Met Everyone Else,How I Met Your Mother,3,5,8.9,4796,112
tt8394332,The Ballad of Roger Mac,Outlander,5,7,9.1,2445,113
tt3282766,Going Home,Once Upon a Time,3,11,9.1,2427,114
tt14729144,Episode #1.6,Young Royals,1,6,9.2,1943,115
tt1142665,Slapsgiving,How I Met Your Mother,3,9,8.9,4572,116
tt3675214,Fear (of the Unknown),Grey's Anatomy,10,24,9.2,1850,117
tt3627460,The Wedding,Outlander,1,7,8.8,6791,118
tt6674430,The Bow Tie Asymmetry,The Big Bang Theory,11,24,8.9,3928,119
tt0583469,The One Where Rachel Finds Out,Friends,1,24,8.8,6256,120
tt2013429,Christmas at Downton Abbey,Downton Abbey,2,9,9.0,2725,121
tt2517458,Fulgencio,Modern Family,4,13,8.9,3737,122
tt4289382,Welcome to the Dollhouse,Pretty Little Liars,5,25,9.2,1696,123
tt10322318,"So Long, Marianne",This Is Us,4,9,9.2,1656,124
tt1627447,Caught in the Act,Modern Family,2,13,8.9,3458,125
tt6463866,All Debts Paid,Outlander,3,3,8.9,3422,126
tt0583437,The One After Ross Says Rachel,Friends,5,1,8.8,5324,127
tt2636338,Cooler,New Girl,2,15,9.0,2493,128
tt3627600,Both Sides Now,Outlander,1,8,8.8,5119,129
tt3415300,The End of the Aisle,How I Met Your Mother,9,22,8.8,5021,130
tt19064728,Family Meeting,This Is Us,6,16,9.2,1602,131
tt0583623,The One with the Late Thanksgiving,Friends,10,8,8.8,4957,132
tt6115034,Last Christmas,This Is Us,1,10,8.9,3204,133
tt0583550,The One with Rachel's Going Away Party,Friends,10,16,8.8,4843,134
tt0583542,The One with Phoebe's Wedding,Friends,10,12,8.8,4827,135
tt6142658,The Big Day,This Is Us,1,12,8.9,3174,136
tt7043724,"Who Lives, Who Dies, Who Tells Your Story",Grey's Anatomy,14,7,9.1,1880,137
tt1256025,The Maternal Capacitance,The Big Bang Theory,2,15,8.8,4722,138
tt0583472,The One Where Rachel Has a Baby: Part 2,Friends,8,24,8.8,4719,139
tt6142664,Jack Pearson's Son,This Is Us,1,15,8.9,3059,140
tt3309570,The Thanksgiving Decoupling,The Big Bang Theory,7,9,8.8,4535,141
tt10322306,Strangers,This Is Us,4,1,9.0,2284,142
tt1263293,What a Difference a Day Makes,Grey's Anatomy,5,22,9.1,1813,143
tt2049132,Ducky Tie,How I Met Your Mother,7,3,8.8,4405,144
tt0901365,De Patre Vostro (About Your Father),Rome,2,10,9.0,2232,145
tt6439906,Songbird Road: Part One,This Is Us,3,11,9.1,1776,146
tt6439914,Her,This Is Us,3,18,9.1,1766,147
tt6142666,What Now?,This Is Us,1,17,8.9,2853,148
tt0994245,Showdown,How I Met Your Mother,2,20,8.8,4123,149
tt2385244,Episode #3.5,Downton Abbey,3,5,9.0,2161,150
tt5791266,The Battle Joined,Outlander,3,1,8.8,4039,151
tt2104525,A Land Without Magic,Once Upon a Time,1,22,8.9,2740,152
tt2095253,Dark Was the Night,Grey's Anatomy,8,9,9.1,1683,153
tt6123984,Det går over,Skam,3,9,9.4,1077,154
tt0583510,The One with All the Poker,Friends,1,18,8.7,6438,155
tt2461460,"New York, I Love You XOXO",Gossip Girl,6,10,9.0,2029,156
tt0592910,Into You Like a Train,Grey's Anatomy,2,6,9.0,2021,157
tt13883792,Friend,Heartstopper,1,5,8.9,2605,158
tt16024734,Don't Let Me Keep You,This Is Us,6,4,9.1,1632,159
tt3794460,"Game On, Charles",Pretty Little Liars,6,1,9.1,1624,160
tt0568033,Love's Labor Lost,ER,1,19,9.2,1371,161
tt0583488,The One Where Ross and Rachel... You Know,Friends,2,15,8.7,5781,162
tt3962976,A Moorland Holiday,Downton Abbey,5,9,9.0,1952,163
tt0903486,Some You Give Away,One Tree Hill,4,9,9.6,835,164
tt4500028,Operation Mongoose: Part 2,Once Upon a Time,4,23,9.0,1900,165
tt0583496,The One at the Beach,Friends,3,25,8.7,5381,166
tt0688357,The Spoils,Rome,1,11,8.9,2349,167
tt1248519,And in the End...,ER,15,22,9.2,1299,168
tt0583484,The One Where Ross Is Fine,Friends,10,2,8.7,5064,169
tt6628452,Five Stars for Beezus,New Girl,6,22,9.1,1523,170
tt0583440,The One Hundredth,Friends,5,3,8.7,5037,171
tt0583632,The One with the Nap Partners,Friends,7,6,8.7,4992,172
tt3602308,Snow Drifts,Once Upon a Time,3,21,9.0,1835,173
tt14729116,Episode #1.5,Young Royals,1,5,9.0,1835,173
tt12599482,Finding The Real Face,It's Okay to Not Be Okay,1,16,9.4,993,175
tt0583553,The One with Rachel's Other Sister,Friends,9,8,8.7,4935,176
tt0583500,The One in Vegas: Part 1,Friends,5,23,8.7,4919,177
tt0583564,The One with Ross's Tan,Friends,10,3,8.7,4907,178
tt1497732,I Saw What I Saw,Grey's Anatomy,6,6,9.0,1812,179
tt0774239,Come On,How I Met Your Mother,1,22,8.7,4792,180
tt0583531,The One with Monica and Chandler's Wedding: Part 1,Friends,7,23,8.7,4778,181
tt1256034,The Barbarian Sublimation,The Big Bang Theory,2,3,8.7,4753,182
tt4568392,Clean Break,New Girl,4,22,9.0,1786,183
tt0789453,Deterioration of the Fight or Flight Response,Grey's Anatomy,2,26,9.0,1784,184
tt0789452,17 Seconds,Grey's Anatomy,2,25,9.0,1779,185
tt4179564,Vengeance Is Mine,Outlander,2,11,8.8,3014,186
tt0788623,Mary the Paralegal,How I Met Your Mother,1,19,8.7,4629,187
tt4462720,Prestonpans,Outlander,2,10,8.8,3010,188
tt2861788,Something New,How I Met Your Mother,8,24,8.7,4495,189
tt3874196,Wentworth Prison,Outlander,1,15,8.7,4462,190
tt3218670,The Scavenger Vortex,The Big Bang Theory,7,3,8.7,4461,191
tt1632224,The Robotic Manipulation,The Big Bang Theory,4,1,8.7,4441,192
tt0858000,"Ted Mosby, Architect",How I Met Your Mother,2,4,8.7,4431,193
tt2121966,Symphony of Illumination,How I Met Your Mother,7,12,8.7,4427,194
tt0583471,The One Where Rachel Has a Baby: Part 1,Friends,8,23,8.7,4387,195
tt9734986,Fear and Loathing in Beverly Hills,You,2,8,8.7,4353,196
tt4581594,Episode #6.8,Downton Abbey,6,8,9.0,1717,197
tt13883784,Crush,Heartstopper,1,2,8.8,2859,198
tt1263283,Stairway to Heaven,Grey's Anatomy,5,13,9.0,1707,199
tt0962364,Drowning on Dry Land,Grey's Anatomy,3,16,9.0,1707,199
tt1795957,Oh Honey,How I Met Your Mother,6,15,8.7,4256,201
tt0866188,World's Greatest Couple,How I Met Your Mother,2,5,8.7,4234,202
tt1204516,Ten Sessions,How I Met Your Mother,3,13,8.7,4217,203
tt13299766,What Is Love?,You,3,10,8.7,4166,204
tt6439846,A Father's Advice,This Is Us,2,1,8.8,2768,205
tt2376745,The Magician's Code: Part 2,How I Met Your Mother,7,24,8.7,4101,206
tt6684170,Eye of the Storm,Outlander,3,13,8.8,2759,207
tt2847436,The Bro Mitzvah,How I Met Your Mother,8,22,8.7,4090,208
tt1632226,The Justice League Recombination,The Big Bang Theory,4,11,8.7,4088,209
tt8394340,Journeycake,Outlander,5,11,8.9,2072,210
tt1576524,Perfect Week,How I Met Your Mother,5,14,8.7,4040,211
tt1256186,Intervention,How I Met Your Mother,4,4,8.7,4039,212
tt1017766,Something Blue,How I Met Your Mother,2,22,8.7,3969,213
tt0982196,Something Borrowed,How I Met Your Mother,2,21,8.7,3908,214
tt13440628,Birth Mother,This Is Us,5,6,8.9,2001,215
tt13841384,In the Room,This Is Us,5,8,9.0,1609,216
tt9691254,"I Can't Hear the Fireworks, Part 2/Kaguya Doesn't Want to Avoid Him",Kaguya-sama: Love is War,1,12,9.4,902,217
tt13883796,Girls,Heartstopper,1,6,8.8,2566,218
tt8394342,Never My Love,Outlander,5,12,8.8,2546,219
tt6439864,Number Three,This Is Us,2,10,8.8,2509,220
tt6085956,The Pool,This Is Us,1,4,8.7,3523,221
tt0958716,"The End's Not Near, It's Here",The O.C.,4,16,9.1,1295,222
tt6686874,A. Malcolm,Outlander,3,6,8.7,3501,223
tt20116760,Chika Fujiwara Wants to Beat a Rhythm/Ai Hayasaka Wants to Talk/Maki Shijo Wants Some Help,Kaguya-sama: Love is War,3,5,9.4,875,224
tt2104399,Suddenly,Grey's Anatomy,8,10,9.0,1519,225
tt0583577,The One with the Birth,Friends,1,23,8.6,5887,226
tt11266786,Track 10: Rock 'n' Roll Suicide,Daisy Jones & The Six,1,10,9.2,1099,227
tt0831047,The One After the Superbowl: Part 2,Friends,2,13,8.6,5731,228
tt14729124,Episode #1.4,Young Royals,1,4,8.9,1817,229
tt18311182,Episode #1.14,Not Me,1,14,9.2,1085,230
tt8399426,Savages,Outlander,4,5,8.8,2331,231
tt3827662,Rent,Outlander,1,5,8.6,5487,232
tt1617366,Episode #1.7,Downton Abbey,1,7,8.8,2278,233
tt0099851,Into the Woods,American Playhouse,10,1,8.7,3170,234
tt0583590,The One with the Chick and the Duck,Friends,3,21,8.6,5018,235
tt0583566,The One with Ross's Wedding,Friends,4,23,8.6,5009,236
tt6690048,Man of Worth,Outlander,4,13,8.8,2215,237
tt0817466,That '70s Finale,That '70s Show,8,22,8.9,1727,238
tt0583444,The One Where Chandler Crosses the Line,Friends,4,7,8.6,4903,239
tt0583622,The One with the Kips,Friends,5,5,8.6,4845,240
tt0583479,The One Where Ross Can't Flirt,Friends,5,19,8.6,4840,241
tt0583438,The One After Vegas,Friends,6,1,8.6,4809,242
tt0583505,The One with All the Haste,Friends,4,19,8.6,4779,243
tt0606106,"Drumroll, Please",How I Met Your Mother,1,13,8.6,4774,244
tt0583650,The One with the Stripper,Friends,8,8,8.6,4681,245
tt9734998,"Love, Actually",You,2,10,8.6,4643,246
tt4179604,The Hail Mary,Outlander,2,12,8.7,2925,247
tt7836784,Bluebeard's Castle,You,1,10,8.6,4624,248
tt0583636,The One with the Proposal,Friends,6,24,8.6,4600,249
tt0583435,The One After I Do,Friends,8,1,8.6,4567,250
tt19870328,My Beautiful Wrinkles,Modern Love: Mumbai,1,4,5.8,250,48524
tt13441948,Voulez-Vous Coucher Avec Moi?,Emily in Paris,2,1,6.8,1146,48525
tt2545360,Give Santa a Tail-Hole,Two and a Half Men,10,11,6.7,850,48526
tt11248108,Dead on a Rival,Modern Family,11,12,6.8,1158,48527
tt14154354,Listen,A Million Little Things,3,13,6.2,371,48528
tt8428572,Whanex?,Modern Family,10,13,6.8,1194,48529
tt13824226,No Strings Attached,And Just Like That...,1,9,6.7,878,48530
tt10964158,A Game of Chicken,Modern Family,11,6,6.8,1228,48531
tt9437218,Strong Girls Don't Break.,Four More Shots Please,1,2,5.4,198,48532
tt13824186,Little Black Dress,And Just Like That...,1,2,6.9,1995,48533
tt11686340,A Fatal Romance,Matchmaker Mysteries,1,2,6.5,588,48534
tt1226876,Episode #1.5300,The Bold and the Beautiful,1,5300,4.4,125,48535
tt27078771,Episode #1.4,Set Me Free,1,4,2.7,77,48536
tt9072292,Excellent Chariots,Away,1,4,6.6,733,48537
tt3596246,West Side Story,Two and a Half Men,11,18,6.6,735,48538
tt6674720,The Inspiration Deprivation,The Big Bang Theory,12,19,6.9,2170,48539
tt19866108,Baai,Modern Love: Mumbai,1,2,6.1,355,48540
tt6957470,Land of the Free,The Night Shift,4,9,6.1,357,48541
tt3549960,How to Get Rid of Alan Harper,Two and a Half Men,11,16,6.6,752,48542
tt23062782,Asexual Healing,Big Mouth,6,8,6.2,400,48543
tt1216343,Episode #1.5301,The Bold and the Beautiful,1,5301,4.2,120,48544
tt13911442,Episode #1.29,You Knock on My Door,1,29,6.7,974,48545
tt13945464,C**kblocked by a Cone,Too Hot to Handle,2,1,5.5,221,48546
tt0802894,Leaving Home Ain't Easy,That '70s Show,8,20,6.5,633,48547
tt8473540,Pilot,"Roswell, New Mexico",1,1,6.7,998,48548
tt14720376,I Did Not See That Coming,Too Hot to Handle,2,10,5.1,179,48549
tt13824224,"Bewitched, Bothered and Bewildered",And Just Like That...,1,8,6.7,1010,48550
tt6412096,Finding Fizbo,Modern Family,8,15,6.8,1423,48551
tt0796169,My Fairy King,That '70s Show,8,16,6.5,640,48552
tt6337212,The Romance Recalibration,The Big Bang Theory,10,13,6.9,2464,48553
tt0295233,Emmanuelle 2000: Jewel of Emmanuelle,Emmanuelle 2000,,,3.9,112,48554
tt0720093,Good Company,That '70s Show,8,8,6.5,654,48555
tt3685316,"Oh WALD-E, Good Times Ahead",Two and a Half Men,11,22,6.6,805,48556
tt0720129,Long Away,That '70s Show,8,6,6.5,663,48557
tt2625938,"Run, Steven Staven! Run!",Two and a Half Men,10,14,6.6,815,48558
tt0799370,We Will Rock You,That '70s Show,8,18,6.5,674,48559
tt3293108,Some Kind of Lesbian Zombie,Two and a Half Men,11,7,6.6,830,48560
tt3420154,Tazed in the Lady Nuts,Two and a Half Men,11,11,6.6,835,48561
tt0588709,New Girls in Town,The Girls Next Door,1,2,4.9,169,48562
tt7088762,The Garden of Forking Paths,Once Upon a Time,7,3,6.7,1097,48563
tt23473020,I'll Follow the Sun,Grey's Anatomy,19,7,6.2,448,48564
tt2452182,Something My Gynecologist Said,Two and a Half Men,10,8,6.6,881,48565
tt11695344,Break on Through,Soulmates,1,5,5.6,261,48566
tt12100012,Love Is In The Air,Four More Shots Please,2,5,4.7,160,48567
tt2136663,iBloop 2: Electric Bloopaloo,iCarly,5,6,5.4,233,48568
tt26863527,Episode #1.2,Set Me Free,1,2,4.4,145,48569
tt0868145,"I See London, I See France",The Girls Next Door,2,8,2.7,88,48570
tt8428562,Blasts from the Past,Modern Family,10,12,6.7,1233,48571
tt2385556,Emir'in Yolu,Adini Feriha Koydum,3,1,4.7,165,48572
tt27426405,The Reunion,Love Is Blind,4,13,3.2,100,48573
tt0780946,Son and Daughter,That '70s Show,8,14,6.4,629,48574
tt11248370,Lag Gayi... Lottery,Rasbhari,1,6,5.0,190,48575
tt10709020,Picture Perfect Mysteries: Dead Over Diamonds,Picture Perfect Mysteries,1,2,6.4,631,48576
tt0796167,Crazy Little Thing Called Love,That '70s Show,8,17,6.4,632,48577
tt12100010,Hell Bent,Four More Shots Please,2,4,4.7,166,48578
tt11248374,Pushpa Ka Plan,Rasbhari,1,7,5.0,192,48579
tt0762534,Killer Queen,That '70s Show,8,12,6.4,644,48580
tt0769458,Sheer Heart Attack,That '70s Show,8,19,6.4,644,48580
tt0868146,When in Rome,The Girls Next Door,2,9,2.5,86,48582
tt2214415,"Sips, Sonnets and Sodomy",Two and a Half Men,9,16,6.6,981,48583
tt6876612,Clash of Swords,Modern Family,9,22,6.7,1315,48584
tt0720204,Who Needs You,That '70s Show,8,9,6.4,656,48585
tt0861117,Sleepwear Optional,The Girls Next Door,2,7,3.0,98,48586
tt26758613,Episode #1.1,Set Me Free,1,1,4.5,158,48587
tt16358820,Episode #1.11,F4 Thailand: Boys Over Flowers,1,11,5.7,307,48588
tt2148711,Slowly and in a Circular Fashion,Two and a Half Men,9,13,6.6,1046,48589
tt6674452,The Athenaeum Allocation,The Big Bang Theory,11,17,6.8,2192,48590
tt14712832,Jules and Em,Emily in Paris,2,4,6.6,1047,48591
tt11248378,Climax,Rasbhari,1,8,5.2,225,48592
tt0583618,The One with the Invitation,Friends,4,21,6.9,5049,48593
tt11305596,Just Another Girl on the MTA,Gossip Girl,1,1,6.6,1070,48594
tt6674694,The Planetarium Collision,The Big Bang Theory,12,5,6.8,2281,48595
tt0720212,You're My Best Friend,That '70s Show,8,3,6.4,701,48596
tt2452166,That's Not What They Call It in Amsterdam,Two and a Half Men,10,5,6.5,862,48597
tt12100028,Step Into The Light,Four More Shots Please,2,7,4.3,153,48598
tt16968790,Dying for Chocolate,Curious Caterer,1,1,6.5,867,48599
tt6876616,I Love a Parade,Modern Family,10,1,6.7,1513,48600
tt10701784,"It's the End of the World, Worm Girl",Younger,7,2,5.3,246,48601
tt12100042,Noughts And Crosses,Four More Shots Please,2,9,4.3,155,48602
tt8231086,The Perfect Bride: Wedding Bells,The Perfect Bride,1,2,6.5,888,48603
tt3131180,Shadow Play,Pretty Little Liars,4,19,6.6,1132,48604
tt0796168,Keep Yourself Alive,That '70s Show,8,15,6.3,633,48605
tt11743526,Somewhere Only We Know,Sex/Life,1,6,6.1,486,48606
tt3457430,Baseball. Boobs. Boobs. Baseball.,Two and a Half Men,11,12,6.4,749,48607
tt11743524,The Sound of the Suburbs,Sex/Life,1,5,6.1,488,48608
tt10428030,Together Forever,Four More Shots Please,2,1,4.2,152,48609
tt0757761,Good Old Fashioned Lover Boy,That '70s Show,8,11,6.3,641,48610
tt10953702,Jasoosi Ki Duniya,Rasbhari,1,2,5.1,227,48611
tt0767644,Spread Your Wings,That '70s Show,8,13,6.3,648,48612
tt8783262,A Killer Engagement,Matchmaker Mysteries,1,1,6.4,765,48613
tt13951960,Episode #1.30,You Knock on My Door,1,30,6.5,939,48614
tt1943584,Thank You for the Intercourse,Two and a Half Men,9,8,6.6,1225,48615
tt2750608,The 9:04 from Pemberton,Two and a Half Men,10,18,6.4,779,48616
tt2890506,My Bodacious Vidalia,Two and a Half Men,10,22,6.4,780,48617
tt11316894,Trick,Run,1,7,5.8,373,48618
tt8582458,Picture Perfect Mysteries: Newlywed and Dead,Picture Perfect Mysteries,1,1,6.4,790,48619
tt9436942,Ambitious. Prude. Feminist. Slut.,Four More Shots Please,1,1,5.2,247,48620
tt12100022,Crossroads,Four More Shots Please,2,6,4.3,163,48621
tt0720172,Sweet Lady,That '70s Show,8,10,6.3,671,48622
tt12100036,Hooking up And Breaking Up,Four More Shots Please,2,8,4.1,152,48623
tt3264442,"Alan Harper, Pleasing Women Since 2003",Two and a Half Men,11,5,6.4,800,48624
tt1100393,Miss Mom/Who's the Champ/Gopher's Delusion,The Love Boat,9,13,4.9,215,48625
tt6055160,Hubbedy Bubby,New Girl,6,2,6.5,1004,48626
tt3345456,"On Vodka, on Soda, on Blender, on Mixer!",Two and a Half Men,11,10,6.4,818,48627
tt2200885,The Duchess of Dull-in-Sack,Two and a Half Men,9,15,6.5,1013,48628
tt2886858,"Cows, Prepare to Be Tipped",Two and a Half Men,10,23,6.4,852,48629
tt3603346,The Matrimonial Momentum,The Big Bang Theory,9,1,6.8,3620,48630
tt11248366,English Speaking Fast Fast,Rasbhari,1,3,4.9,222,48631
tt3497604,Three Fingers of Crème de Menthe,Two and a Half Men,11,14,6.3,723,48632
tt3509564,Cab Fare and a Bottle of Penicillin,Two and a Half Men,11,15,6.3,725,48633
tt2415988,You Do Know What the Lollipop Is For,Two and a Half Men,10,4,6.5,1070,48634
tt13824218,Sex and the Widow,And Just Like That...,1,7,6.5,1072,48635
tt9728344,New Kids on the Block,Modern Family,11,1,6.6,1461,48636
tt12100000,Spring Cleaning,Four More Shots Please,2,3,4.2,170,48637
tt2874552,Another Night with Neil Diamond,Two and a Half Men,10,21,6.3,761,48638
tt2710722,"Advantage: Fat, Flying Baby",Two and a Half Men,10,16,6.3,762,48639
tt11248368,Madam Ke Husband Bhole Hain Bade,Rasbhari,1,4,4.8,221,48640
tt6565530,The Cognition Regeneration,The Big Bang Theory,10,22,6.7,2298,48641
tt13824210,Diwali,And Just Like That...,1,6,6.5,1160,48642
tt2710726,Throgwarten Middle School Mysteries,Two and a Half Men,10,17,6.3,783,48643
tt2327121,Oh Look! Al-Qaeda!,Two and a Half Men,9,24,6.4,951,48644
tt11743528,Small Town Saturday Night,Sex/Life,1,7,5.9,474,48645
tt2172809,A Possum on Chemo,Two and a Half Men,9,14,6.4,970,48646
tt2587444,Welcome to Alancrest,Two and a Half Men,10,12,6.3,829,48647
tt12099996,Love Is A 4-Letter Word. Fuck Lust Hate Loss Fate,Four More Shots Please,2,2,4.2,180,48648
tt3233256,"Clank, Clank, Drunken Skank",Two and a Half Men,11,4,6.3,831,48649
tt0446319,Emmanuelle 2000: Emmanuelle Pie,Emmanuelle 2000,,,4.4,195,48650
tt3685312,Dial 1-900-Mix-A-Lot,Two and a Half Men,11,21,6.2,714,48651
tt11743520,Empire State of Mind,Sex/Life,1,3,6.0,552,48652
tt10702140,Older,Younger,7,12,5.8,460,48653
tt2439776,A Big Bag of Dog,Two and a Half Men,10,2,6.3,881,48654
tt3341266,"Mr. Walden, He Die. I Clean Room.",Two and a Half Men,11,8,6.2,749,48655
tt2292299,"Palmdale, Ech",Two and a Half Men,9,19,6.3,901,48656
tt14330910,Sign O' the Times,Grey's Anatomy,17,12,6.4,1115,48657
tt3472166,"Bite Me, Supreme Court",Two and a Half Men,11,13,6.2,782,48658
tt14002556,Gerçek Ask,You Knock on My Door,1,31,6.3,930,48659
tt11743518,Down in the Tube Station at Midnight,Sex/Life,1,2,6.0,602,48660
tt2452174,Avoid the Chinese Mustard,Two and a Half Men,10,7,6.3,937,48661
tt6874542,The Perfect Bride,The Perfect Bride,1,1,6.5,1486,48662
tt11743522,New New York,Sex/Life,1,4,5.8,491,48663
tt6878636,Hyperion Heights,Once Upon a Time,7,1,6.5,1490,48664
tt12100048,The One,Four More Shots Please,2,10,4.0,182,48665
tt1943585,Frodo's Headshots,Two and a Half Men,9,9,6.4,1189,48666
tt2318211,Why We Gave Up Women,Two and a Half Men,9,22,6.3,971,48667
tt11333484,Bhootni Ke Jalwe,Rasbhari,1,5,4.6,233,48668
tt3293104,Justice in Star-Spangled Hot Pants,Two and a Half Men,11,6,6.2,823,48669
tt0657319,The Chatterbox,The Nanny,2,25,5.6,424,48670
tt0295231,Emmanuelle 2000: Emmanuelle in Paradise,Emmanuelle 2000,,,3.7,167,48671
tt2361001,Mr. Hose Says 'Yes',Two and a Half Men,9,21,6.2,863,48672
tt18351146,The Makings of You,Grey's Anatomy,18,12,5.9,583,48673
tt13824200,Some of My Best Friends,And Just Like That...,1,4,6.4,1285,48674
tt2118471,What a Lovely Landing Strip,Two and a Half Men,9,11,6.3,1048,48675
